<?xml version="1.0"?>
<!DOCTYPE PPLTDevice SYSTEM "PPLT-Device-0.1.dtd">
<PPLTDevice name="S7-200" class="PLC">
    <Head>
		<Description lang="de">Dieses Gerät gibt ihnen die Möglichkeit,
		auf die Merker einer SIMATIC S7 Steuerung zu zugreifen.</Description>
		<Description lang="en">This device gives you access to the markers
		of a SIMATIC S7 PLC.</Description>

        <Require>
            <DCPUModule>Master.Interface.UniSerial</DCPUModule>
            <DCPUModule>Master.Transport.PPI</DCPUModule>
            <DCPUModule>Master.Device.S7</DCPUModule>
			<Variable name="Port" default="0">
				<Description lang="de">Geben sie hier die serielle 
				Schnittstelle an, an die die Steuerung angschlossen ist.
				(0 = COM1(ttyS0), 1 = COM2(ttyS1), ...)</Description>
				<Description lang="en">Put here the number of the
				serial interface. (0 = COM1(ttyS0), 1 = COM2(ttyS1), ...)
				</Description>
			</Variable>
			<Variable name="PCAddr" default="0">
				<Description lang="de">Geben sie hier die Adresse des PCs
				innerhalb des PPI Busses an, (Üblicherweise 0)</Description>
				<Description lang="en">Put here the PPI address of the PC.
				(Norm. 0)</Description> 
			</Variable>
			<Variable name="S7Addr" default="2">
				<Description lang="de">Geben sie hier die PPI Adresse der
				Setuerung an. (Üblicherweise 1..35)</Description>
				<Description lang="en">Put here the PPI address of the PLC.
				(Norm. 1..35)</Description>
			</Variable>
        </Require>

		<Provide>
			<NameSpace name="Marker">
				<SlotRange name="Markers" mode="rw">
					<Description lang="de">Dieser Slot-Bereich gibt ihnen den
					Zugriff auf die Merker der Steuerung. Geben sie hier bitte
					die Adresse der Merkers an, den sie Verwenden wollen.
					</Description>
					<Description lang="en">This slot-range gives you access to
					the markers of the PLC. Please put here the address of the 
					marker you want to use.</Description>
				</SlotRange>
			</NameSpace>
		</Provide>
    </Head>

    
    <Setup>
        <Load name="Master.Interface.UniSerial">
            <Parameter name="Port"><Variable name="Port"/></Parameter>
            <Parameter name="TimeOut">1.0</Parameter>
			<Parameter name="Parity">Even</Parameter>
            <Parameter name="Speed">9600</Parameter>
            <Load name="Master.Transport.PPI">
				<Parameter name="Address"><Variable name="PCAddr"/></Parameter>
				<Load name="Master.Device.S7" namespace="Marker">
					<Address><Variable name="S7Addr"/></Address>
				</Load>
			</Load>
        </Load>
    </Setup>
        
</PPLTDevice>
