<?xml version="1.0"?>
<!DOCTYPE PPLTDevice SYSTEM "PPLT-Device-0.1.dtd">
<PPLTDevice name="RandomGenerator" class="Debug" version="0.4.0">
	<Head>
		<Description lang="de">
			Der Generator erzeugt Zufallswerte in verschiedenen Type,
			wie Bool, Ganzzahl, Fließkomma.
		</Description>
		<Description lang="en">
			This device generates some random values in several types,
			like bool, integer of floatingpoint.
		</Description>		

		<Require>
			<DCPUModule>Master.Debug.Random</DCPUModule>
		</Require>
		<Provide>
			<NameSpace name="Generator">
				<Slot name="Bool" type="Bool" mode="r">
					<Description lang="de">Boolscher Zufallswert</Description>
					<Description lang="en">Boolean random value</Description>
				</Slot>
				<Slot name="Integer" type="Integer" mode="r">
					<Description lang="de">Zufallswert zischen 0-100</Description>
					<Description lang="en">Random value (0-100)</Description>
				</Slot>
				<Slot name="Float" type="Float" mode="r">
					<Description lang="de">Zufallswert zischen 0-1.0</Description>
					<Description lang="en">Random value (0-1.0)</Description>
				</Slot>
			    <Slot name="String" type="String" mode="r">
                    <Description lang="de">Zufälliger string mit druckbaren Zeichen.</Description>
                    <Description lang="en">Random string with printable characters.</Description>
                </Slot>
                <Slot name="ArrayBool" type="ArrayBool" mode="r">
                    <Description lang="en">Array of random boolean values.</Description>
                    <Description lang="de">Feld mit zufälligen boolschen Werten.
                    </Description>
                </Slot>    
                <Slot name="ArrayInteger" type="ArrayInteger" mode="r">
                    <Description lang="en">Array of random integer values.</Description>
                    <Description lang="de">Feld mit zufälligen ganz-zahligen Werten.
                    </Description>
                </Slot>    
                <Slot name="ArrayFloat" type="ArrayFloat" mode="r">
                    <Description lang="en">Array of random floating-point values.</Description>
                    <Description lang="de">Feld mit zufälligen fließkomma Werten.
                    </Description>
                </Slot>    
                <Slot name="ArrayString" type="ArrayString" mode="r">
                    <Description lang="en">Array of random strings.</Description>
                    <Description lang="de">Feld mit zufälligen Strings.  </Description>
                </Slot>    
                <Slot name="Stream" type="Stream" mode="r">
                    <Description lang="en">Stream of random printable character.</Description>
                    <Description lang="de">Datenstrom aus zufälligen Zeichen.  </Description>
                </Slot>    
                <Slot name="Sequence" type="Sequence" mode="r">
                    <Description lang="en">Sequence of random printable character.</Description>
                    <Description lang="de">Datensequenz aus zufälligen Zeichen.  </Description>
                </Slot>    
            </NameSpace>
		</Provide>
	</Head>
	
	<Setup>
		<Load name="Master.Debug.Random" namespace="Generator"/>
	</Setup>
</PPLTDevice>
