<?xml version="1.0"?>
<!DOCTYPE PPLTDevice SYSTEM "PPLT-Device-0.1.dtd">
<PPLTDevice name="GSMMobilePhone" class="Mobile" version="0.3.0">
    <Head>
		<Description lang="de">Dieses Gerät bietet den Zugriff auf ein GSM 
		kompatibles Mobiltelefon. Dabei können Werte wie der Herstellername
		oder der Batteriestand abgefragt werden.
		</Description>
		<Description lang="en">This Device provides access to a GSM compatible
		mobilephone. You can read out values like battery-level or 
		manufacturer-name.
		</Description>

		<!-- The require section list all needed modules and variables //-->
        <Require>
            <DCPUModule>Master.Interface.UniSerial</DCPUModule>
            <DCPUModule>Master.Device.GSM</DCPUModule>
        
			<!-- Needed variables(with help) //-->
			<Variable name="Port" default="0">
				<Description lang="de">Die serielle Schnitstelle, an die das 
				Telefon an geschlossen ist. 0 = COM1(ttyS0), 1 = COM2 ...
				</Description>
				<Description lang="en">The serial device the mobile is connected. 
				0 = COM1(ttyS0), 1 = COM2 ...
				</Description>
			</Variable>
			<Variable name="Speed" default="9600">
				<Description lang="de">Die Geschwindigkeit in Baud, die für die 
				Kommunikation mit dem Handy verwendet werden soll. Zum Beispiel
				9600, 19200, 115200.</Description>
				<Description lang="en">The speed in baud to be used for 
				communication with the mobilephone. For example 9600, 19200,
				115200.</Description>
			</Variable>
		</Require>
		
		<!-- The Provide section list and define all NameSpaces //-->
		<Provide>
			<NameSpace name="GSM">
				<!-- define Slot battery with description field //-->
				<Slot name="battery" type="uInteger" mode="r">
					<Description lang="de">Gibt den Batteriestand in Prozent an.</Description>
					<Description lang="en">Shows the battery level.</Description>
				</Slot>
                <Slot name="network" type="uInteger" mode="r">
                    <Description lang="de">Gibt den Netzwerkstatus des Telefons wieder.</Description>
                    <Description lang="en">Returns the network status.</Description>
                </Slot>
				<!-- define Slot quality //-->
				<Slot name="quality" type="uInteger" mode="r">
					<Description lang="de">Gibt die Signalqualität an.</Description>
					<Description lang="en">Shows the signal quality.</Description>
				</Slot>
                <Slot name="errorrate" type="uInteger" mode="r">
                    <Description lang="de">Gibt die Fehlerrate wieder.</Description>
                    <Description lang="en">Returns the error rate.</Description>
                </Slot>
				<!-- define Slot manufacturer //-->
				<Slot name="manufacturer" type="String" mode="r">
					<Description lang="de">Hersteller Name.</Description>
					<Description lang="en">Manufacturer name.</Description>
				</Slot>
				<!-- define Slot model //-->
				<Slot name="model" type="String" mode="r">
					<Description lang="de">Modell-Nummer oder Name</Description>
					<Description lang="en">Model number or name.</Description>
				</Slot>
                <SlotRange name="sms" type="String">
                    <Description lang="de">Sendet eine SMS an den angegebenen Emfänger (Bsp: sms:017012345678)</Description>
                    <Description lang="en">Sends a SMS to the given reciver. (Ex: sms:017012345678)</Description>
                </SlotRange>
			</NameSpace>
		</Provide>
    </Head>


    
    <!-- Description how to load the core modules //-->
	<Setup>
        <Load name="Master.Interface.UniSerial">
            <Parameter name="Port"><Variable name="Port"/></Parameter>
            <Parameter name="TimeOut">2.0</Parameter>
			<Parameter name="Parity">None</Parameter>
            <Parameter name="Speed"><Variable name="Speed"/></Parameter>
            <Load name="Master.Device.GSM" namespace="GSM"/>
        </Load>
    </Setup>
        
</PPLTDevice>
