<?xml version="1.0"?>
<!DOCTYPE PPLTDevice SYSTEM "PPLT-Device-0.1.dtd">
<PPLTDevice name="RandomGenerator" class="Debug" version="0.3.0">
	<Head>
		<Description lang="de">
			Der Generator erzeugt Zufallswerte in verschiedenen Type,
			wie Bool, Ganzzahl, Flie√ükomma.
		</Description>
		<Description lang="en">
			This device generates some random values in several types,
			like bool, integer of floatingpoint.
		</Description>		

		<Require>
			<DCPUModule>Master.Debug.Random</DCPUModule>
		</Require>
		<Provide>
			<NameSpace name="Generator">
				<Slot name="Bool" type="Bool" mode="r">
					<Description lang="de">Boolscher Zufallswert</Description>
					<Description lang="en">Boolean random value</Description>
				</Slot>
				<Slot name="Byte" type="Byte" mode="r">
					<Description lang="de">Zufallswert zischen 0-100</Description>
					<Description lang="en">Random value (0-100)</Description>
				</Slot>
				<Slot name="Word" type="Word" mode="r">
					<Description lang="de">Zufallswert zischen 0-100</Description>
					<Description lang="en">Random value (0-100)</Description>
				</Slot>
				<Slot name="DWord" type="DWord" mode="r">
					<Description lang="de">Zufallswert zischen 0-100</Description>
					<Description lang="en">Random value (0-100)</Description>
				</Slot>
				<Slot name="Float" type="Float" mode="r">
					<Description lang="de">Zufallswert zischen 0-1.0</Description>
					<Description lang="en">Random value (0-1.0)</Description>
				</Slot>
				<Slot name="Double" type="Double" mode="r">
					<Description lang="de">Zufallswert zischen 0-100</Description>
					<Description lang="en">Random value (0-1.0)</Description>
				</Slot>
			</NameSpace>
		</Provide>
	</Head>
	
	<Setup>
		<Load name="Master.Debug.Random" namespace="Generator"/>
	</Setup>
</PPLTDevice>
