<?xml version="1.0"?>
<!DOCTYPE PPLTDevice SYSTEM "PPLT-Device-0.1.dtd">
<PPLTDevice name="AGILENT-5462X" class="Measure" version="0.3.0">
    <Head>
		<Description lang="de">Mit diesem Gerät, können sie auf die 
		Oszilloskope der 5462-Reihe von Agilent zugreifen und diese steuern.
		Sie können so Messungen veranlassen und die Ergebnisse auslesen. 
		Stellen sie  dazu folgende Parameter beim Oszilloskop ein: 
		(Schnittstelle=seriell, Parität=Keine, Geschwindigkeit=57600,
		Flußkontrolle=RTS/TSR)
		</Description>
		<Description lang="en">With this device you can access the 
		oscilloscopes of the 5462-series by Agilent. So you can init measures		
		and read out the results. Set following parameters on oscilloscope:
		(interface=serial, parity=none, speed=57600, flowcontrol:RTS/TSR)
		</Description>
 
		<Require>
            <DCPUModule>Master.Interface.UniSerial</DCPUModule>
            <DCPUModule>Master.Transport.ReadLine</DCPUModule>
            <DCPUModule>Master.Device.5462X</DCPUModule>
			<Variable name="Port" default="0">
				<Description lang="de">Geben sie hier die serielle 
				Schnittstelle an, an die das Oszilloskop angeschlossen
				ist. (0 = COM1(ttyS0), 1 = COM2(ttyS1), ...)
				</Description>
				<Description lang="en">Put here the number of the serial
				interface. (0 = COM1(ttyS0), 1 = COM2(ttyS1), ...)
				</Description>
			</Variable>
			<Variable name="Primary" default="A1">
				<Description lang="de">Geben die hier die primäre Signalquelle
				an. Zum Beispiel (A1 = erster analog Eingang, A2 = zweiter...)
				</Description>
				<Description lang="en">Put here the primary signalsource. 
				(A1 = first analog input, A2 = second...)
				</Description>
			</Variable>
			<Variable name="Secondary" default="A2">
				<Description lang="de">Geben die hier die sekundäre Signalquelle
				an. Zum Beispiel (A1 = erster analog Eingang, A2 = zweiter...)
				</Description>
				<Description lang="en">Put here the secondary signalsource. 
				(A1 = first analog input, A2 = second...)
				</Description>
			</Variable>
        </Require>

		<Provide>
			<NameSpace name="Values">
				<Slot name="amp" type="Double" mode="r">
					<Description lang="de">Amplitude</Description>
					<Description lang="en">Amplitude</Description>
				</Slot>
				<Slot name="freq" type="Double" mode="r">
					<Description lang="de">Frequenz</Description>
					<Description lang="en">Frequency</Description>
				</Slot>
				<Slot name="phase" type="Double" mode="r">
					<Description lang="de">Phasendifferenz</Description>
					<Description lang="en">Phasediff.</Description>
				</Slot>
				<Slot name="max" type="Double" mode="r"/>
				<Slot name="min" type="Double" mode="r"/>
				<Slot name="pp" type="Double" mode="r"/>
				<Slot name="top" type="Double" mode="r"/>
				<Slot name="base" type="Double" mode="r"/>
				<Slot name="width" type="Double" mode="r"/>
			</NameSpace>			
		</Provide>
    </Head>
    
    <Setup>
        <Load name="Master.Interface.UniSerial">
            <Parameter name="Port"><Variable name="Port"/></Parameter>
            <Parameter name="TimeOut">1.0</Parameter>
			<Parameter name="Parity">None</Parameter>
            <Parameter name="Speed">57600</Parameter>
            <Load name="Master.Transport.ReadLine">
				<Parameter name="LineEnd">0A</Parameter>
            	<Load name="Master.Device.5462X" namespace="Values">
					<Parameter name="PSource"><Variable name="Primary"/></Parameter>
					<Parameter name="SSource"><Variable name="Secondary"/></Parameter>
				</Load>
			</Load>
        </Load>
    </Setup>
        
</PPLTDevice>
